,Company Name,Industry,City,State,LIEmployees,Company Type,Description,Website,Specialties
98,Yodle,Internet,New York,NY,757,Privately Held,"Yodle is a leader in local online marketing and has been ranked on Forbes’ list of America's Most Promising Companies for the last four years. Yodle helps local businesses find and keep their customers in the simplest, most profitable ways imaginable.  

Yodle was founded in 2005 and has 50,000+ customers across 250+ industries. Yodle helps local businesses build a strong online presence. Its combination of automated technology and the support of a full service marketing team makes Yodle easy to use and saves considerable time for local business owners.

Yodle’s product offerings designed specifically for local businesses include:
•	Marketing Essentials™, a comprehensive suite of solutions that includes mobile, desktop and social web presence, the ability to collect and manage reviews and photos, social media management, SEO automation, listings syndication across multiple online channels, offer management, and email marketing  
•	Yodle Ads, a proprietary and optimized paid search advertising offering that is available as a complement to Marketing Essentials 
•	Lighthouse 360™, a business practice automation product which automates many of our customers’ daily consumer interactions or office routines such as appointment reminders and is built to improve operational efficiencies 

Yodle also delivers Centermark™, a distributed marketing automation platform, to networked businesses, i.e., franchises, manufacturers/dealers, and multi-location companies. 

Yodle has more than 1,200 employees across five offices and has been recognized as a best place to work by numerous organizations. The company is headquartered in New York City and is also based in Austin, TX; Charlotte, NC; Scottsdale, AZ and Atlanta, GA.

For more information, visit www.yodle.com, www.yodleinsights.com, or see Yodle reviews from customers at www.yodle.com/success-stories/video-testimonials. You can also find out about careers at Yodle at www.yodlecareers.com and www.yodle.us.",http://www.yodle.com/,"['Local Online Marketing', ' Desktop and Mobile Websites', ' Search Engine Marketing', ' Paid Search Advertising', ' Search Engine Optimization', ' Maps Optimization', ' Relationship Marketing', ' and Patient Communication Software']"
99,HubSpot,Internet,Cambridge,MA,3056,Public Company,"HubSpot is the world’s leading inbound marketing and sales platform. Since 2006, HubSpot has been on a mission to make the world more inbound. Today, 41,500+ customers in more than 90 countries use HubSpot’s software, services, and support to transform the way they attract, engage, and delight customers. 

HubSpot is a global company with offices in Cambridge, MA; Dublin, Ireland; Singapore; Sydney, Australia; Tokyo, Japan; Berlin, Germany; Bogotá, Colombia; and Portsmouth, NH. HubSpot has been recognized by Inc., Forbes, and Deloitte as one of the world’s fastest-growing companies. 

HubSpot's software has helped companies worldwide change how they market and sell, while our innovative approach to company culture has helped redefine transparency and autonomy in the modern workplace. 

To learn more about HubSpot's software, visit www.hubspot.com
and to join our team, visit www.hubspot.com/jobs",https://www.hubspot.com,"['inbound marketing', ' marketing', ' internet marketing', ' online marketing', ' web marketing', ' software', ' blogging', ' SEO', ' marketing automation', ' social media', ' email marketing', ' analytics', ' sales', ' and inbound sales']"
100,CareerBuilder,Internet,Chicago,Illinois,2788,Privately Held,"CareerBuilder is a global, end-to-end human capital solutions company focused on helping employers find, hire and manage great talent. Combining advertising, software and services, CareerBuilder leads the industry in recruiting solutions, employment screening and human capital management. CareerBuilder is majority-owned by funds managed by affiliates of Apollo Global Management, LLC and operates in the United States, Canada, Europe and Asia. For more information, visit www.careerbuilder.com.",http://www.careerbuilder.com,"['Candidate Sourcing', ' Workforce Analytics', ' and HR Software']"
101,"Google, Social Marketing Tools",Internet,Mountain View,CA,1902,Public Company,"Google is one of the world’s largest social media marketing software providers, with over 21,000 paying customers worldwide, including 30 of the world's 50 most valuable brands. Google’s social marketing suite combines best-of-breed social promotion and advertising software, robust mobile and desktop page management, messaging and sophisticated real-time analytics in one complete platform. 

The combination of previously acquired technology with Google’s advertising solutions will help provide a more holistic way for brands to manage and optimize their marketing efforts and spend across all digital channels, including search, display, video, mobile, and social.

Google’s social media marketing division, formerly known as Wildfire, has been recognized for its innovation, inspiring leadership and contribution to the economy. In 2012, President Obama invited Wildfire Founder Victoria Ransom to Washington to represent Silicon Valley at the signing of the JOBS act in the White House Rose Garden.",http://www.google.com,"['Marketing', ' Social Media', ' social media marketing', ' LinkedIn Applications', ' Facebook Applications', ' facebook developer', ' Ruby on Rails', ' Facebook', ' and Twitter']"
102,VAGAS.com,Internet,So Paulo,SP,270,Privately Held,"A VAGAS é líder no segmento de tecnologia para e-recruitment no Brasil. Sua solução VAGAS e-partner é utilizada por profissionais de RH para gerenciar, de maneira mais simples e eficiente, os processos de recrutamento e seleção de mais de 2500 empresas dos mais variados segmentos e portes. Entre as 100 maiores empresas do Brasil, 65 contratam com a tecnologia VAGAS.
 
A VAGAS também é responsável pelo site de carreira VAGAS.com.br - um dos maiores e mais conceituados bancos de talentos da Internet no Brasil, com mais de 8 milhões de currículos cadastrados, cujos serviços são 100% gratuitos a candidatos.

O sistema VAGAS administra mais de 80 milhões de currículos, entre os bancos exclusivos de clientes VAGAS e-partner e o site VAGAS.com.br. O site recebe 5 milhões de visitantes únicos por mês, e o volume de 115 milhões de pageviews o coloca entre os 200 maiores sites do Brasil e 6 mil do mundo.

Se você quiser fazer parte desta equipe, acesse http://www.vagas.com.br/vagas",http://www.vagas.com.br,"['e-recruitment solutions', ' ATS solutions', ' job site', ' and career site']"
103,WalkMe,Internet,San Francisco,California,609,Privately Held,"WalkMe has pioneered the Digital Adoption Platform (DAP) to simplify user experience  using insights, engagement and guidance capabilities.

Founded in 2011, WalkMe’s mission is to match the capability of people with the capability of modern enterprise technology - making global software adoption simple. 

Our platform works as a layer of visual clues and personalized content placed on top of your website or enterprise software. Onboard new users, train existing users on new processes, and improve overall productivity by providing contextual guidance in real-time. 

WalkMe’s DAP is used by thousands of enterprises worldwide spanning all industries and platforms.

Come meet us in person and learn more:  https://www.walkme.com/meet-us-at/",https://www.walkme.com,"['SaaS Solutions', ' User Experience', ' Customer Support', ' Online Training', ' Customer Experience ', ' Digital Adoption', ' Digital Transformation ', ' CRM Support ', ' HCM Support ', ' Online Navigation', ' Analytics ', ' Employee Productivity', ' Employee Onboarding', ' Online Customer Care', ' Software Implementation', ' Conversion Rate Optimization ', ' and Employee Training']"
104,Moz,Internet,Seattle,WA,289,Privately Held,"Marketing Analytics Software for SEO, Links, Social, and Brand • A Vibrant Online Marketing Community • Resources for Learning Inbound Marketing

Moz develops inbound marketing software, provides robust APIs for link data and social influence, and hosts the web's most vibrant community of online marketers. Here at Moz, we believe in better marketing: optimizing your site so it can be found on the web, being responsive through social media, joining relevant conversations about your industry, and creating content that people love. We build tools like Moz Pro and create educational resources to help make better marketing possible for everyone.",http://mz.cm/freetrialLI,"['SEO', ' search engine optimization', ' tools', ' web application development', ' user experience', ' seo software', ' marketing analytics', ' better marketing', ' inbound marketing', ' software', ' tutorials', ' search marketing', ' big data', ' community building', ' and marketing software']"
105,Internet Brands,Internet,El Segundo,CA,1363,Privately Held,"Since launching in 1998 as CarsDirect.com, Internet Brands has grown to become a fully integrated online media and client services organization focused on four high-value vertical categories: Automotive, Health, Legal and Home / Travel.

The company’s award-winning consumer websites lead their categories and serve more than 100 million monthly visitors, while a full range of web presence offerings has established deep, long-term relationships with SMB and enterprise clients.

Internet Brands’ powerful, propriety operating platform provides the flexibility and scalability to fuel the company’s continued growth.

Internet Brands is headquartered in El Segundo, Calif., and operates dozens of satellite offices around the world, including offices in New York City, San Francisco, Chicago, Seattle, and San Diego.",http://www.internetbrands.com,"['internet', ' online advertising', ' web publishing', ' social media', ' e-commerce', ' new media', ' software as a service', ' SaaS', ' cloud software', ' online marketing solutions', ' and web presence solutions']"
106,Web.com,Internet,Jacksonville,FL,4189,Public Company,"Web.com Group, Inc. (Nasdaq: WEB) provides a full range of Internet services to small businesses to help them compete and succeed online. Web.com is owner of several global domain registrars and further meets the needs of small businesses anywhere along their lifecycle with affordable, subscription-based solutions including website design and management, search engine optimization, online marketing campaigns, local sales leads, social media, mobile products, eCommerce solutions, and call center services.

For more information about the company, visit http://www.web.com/ or call 1-800-986-1477.",http://www.web.com,"['domain name registration services', ' website design', ' eCommerce website design', ' search engine optimization', ' search engine marketing', ' shopping cart software', ' local sales leads', ' logo design', ' call center services', ' and Facebook business pages']"
107,G2 Crowd,Internet,Chicago,IL,217,Privately Held,"Real Users. Real Reviews. 

Until recently, selecting business software or services was difficult, risky and inherently biased. G2 Crowd's real, verified user reviews help you objectively assess what's best for your business.

Leverage the crowd, limit your risk, and get what works!",http://www.g2crowd.com,"['Business Software Reviews', ' Best Software', ' Technology Research', ' CRM', ' Marketing Software', ' SaaS', ' Business Intelligence', ' Marketing Automation', ' Enterprise Software', ' E-Signature', ' Help Desk', ' MarTech', ' B2B Services', ' B2B Software', ' B2B', ' User Reviews', ' and B2B Reviews']"
108,"Reddit, Inc.",Internet,San Francisco,California,569,Privately Held,"Founded by Steve Huffman and Alexis Ohanian in 2005, Reddit is an online community where users submit, vote, and comment on content, news, and discussions. Nicknamed ""the front page of the internet,""? Reddit is one of the top ten sites in the United States (source: Alexa), with hundreds of millions of users each month on desktop, mobile web, and our official Android/iOS apps. 

Interested in joining our growing team? Check out about.reddit.com/careers",http://about.reddit.com,"['Software Engineering', ' Full-Stack Engineering', ' Frontend Engineering', ' Backend Engineering', ' Social Media', ' Data Science ', ' Mobile Apps', ' and Online Advertising']"
109,Stack Overflow,Internet,New York,NY,334,Privately Held,"Stack Overflow is the largest, most trusted online community for developers to learn, share their knowledge, and build their careers. More than 50 million professional and aspiring programmers visit Stack Overflow each month to help solve coding problems, develop new skills, and find job opportunities.

Founded in 2008, Stack Overflow partners with businesses to help them understand, hire, engage, and enable the world's developers. To learn more about Stack Overflow's business solutions - technical recruiting, advertising, market research, and enterprise knowledge sharing visit stackoverflowbusiness.com.",http://stackoverflow.com,"['Software Engineering', ' Q&A', ' Communities', ' and Recruitment and Hiring']"
110,SEOmoz,Internet,Seattle,WA,61,Privately Held,"SEOmoz is the world’s most popular provider of SEO software. Their easy to use tools and tutorials make search engine optimization accessible to everyone. The powerful SEOmoz API delivers our Linkscape web crawl data to their campaign-based web app, SEO tools, Open Site Explorer and dozens of third-party applications.

SEOmoz home offices in Seattle, WA serve as the base of operations, but mozzers are frequently found globetrotting across the planet, speaking at conferences & participating in local events. They have participated in search events in more than 15 countries since 2007.

The company’s goal is to provide exceptional software and education to businesses, individuals, non-profits and government organizations so they can best leverage the unique reach of the Internet to increase visibility and achieve success.",http://www.seomoz.org,"['SEO', ' software', ' tools', ' tutorials', ' search engine optimization', ' search marketing', ' web application development', ' big data', ' user experience', ' community building', ' seo software', ' marketing software', ' and inbound marketing']"
111,Saavn,Internet,New York,NY,193,Privately Held,"Saavn is transforming how people around the world access and experience music on a daily basis, by making it easy to browse, search, and play the best of Bollywood, South Asian, and International music. Through partnerships with Apple, Google, Twitter, Facebook, Shazam, and Bollywood actor Ranbir Kapoor, we reach more music fans than any other South Asian music service. 

Saavn's award-winning iOS and Android mobile products include proprietary phonetic search, dynamic bit rate streaming, global native ad-serving, unique radio algorithms, high performance infrastructure, and industry-leading design. We also recently launched Saavn Data, providing the public with a fascinating look at global music listening habits, based on the 21 terabytes of data Saavn collects every month. 

Our team comes from Yahoo, Twitter, LinkedIn, Google, Qualcomm, HBO, Dish Network, MSN and NDTV, reflecting strong expertise in both technology and media.  We have been covered by TechCrunch, Forbes, TIME Magazine, CNBC, and the Wall Street Journal and are backed by top-tier VCs that share our long-term vision for changing the industry.

Saavn has offices in New York City; Mountain View, California; Mumbai; Gurgaon; and Bangalore.",http://saavn.com,"['Bollywood Music', ' Hindi Music', ' Tamil Music', ' Telugu Music', ' Kannada Music', ' Punjabi Music', ' Gujurati Music', ' Bengali music', ' Content Licensing', ' Software Engineering', ' Ad Sales', ' Brand Partnerships', ' Online Marketing', ' International Music', ' English Music', ' Music Streaming', ' and Apps']"
112,Limelight Networks,Internet,Tempe,AZ,652,Public Company,"Limelight Networks (NASDAQ: LLNW), a global leader in digital content delivery, empowers customers to better engage digital audiences by enabling them to optimize and deliver digital content on any device, anywhere in the world. The company's award winning Limelight Orchestrate™ platform includes an integrated suite of content delivery technology and services that helps organizations deliver exceptional multi-screen experiences, improve brand awareness, drive revenue, and enhance customer relationships — all while reducing costs. For more information, please visit www.limelight.com, read our blog, follow us on Twitter® at www.twitter.com/llnw, Facebook www.facebook.com/LimelightNetworks and be sure to visit Limelight Connect.",http://www.limelight.com,"['User Experience Management', ' Content Delivery Network', ' Website Performance', ' Cloud Storage', ' Online Video Platform (OVP)', ' Mobile Delivery', ' Software as a Service (SaaS)', ' Streaming', ' Live Streaming Events', ' Connected Devices', ' security', ' WAF', ' and DDoS Protection']"
113,Base CRM,Internet,Mountain View,CA,171,Privately Held,"Base provides an all-in-one sales platform designed to help reps sell more and give sales leaders quantifiable and actionable insights to grow their business. Base helps it’s 7,000+ customers including Groupon, Cisco, Dow Chemical and Blue Raven Solar take a more scientific approach to sales. Founded in 2009 and headquartered in Mountain View, Base has offices in San Francisco and Krakow, Poland. 

Learn more at www.getbase.com.

If you interested in engineering roles in Poland check out: lab.getbase.com.",https://getbase.com/,"['CRM', ' Sales Tracking Software', ' Mobile CRM', ' Post-PC CRM', ' Web CRM', ' Pipeline Management', ' Sales Analytics', ' Sales Insights', ' Sales Science', ' and Sales Intelligence']"
114,Born Group,Internet,New York,New York,675,Privately Held,"Connecting creative, content and commerce, BORN is an award winning, global agency that helps brands with digital transformation. 

BORN is a global agency that is probably the most awarded agency in its class. It produces unique brand experiences by connecting ten specialisms that serve as the foundation of the digital economy: creative design, content production, commerce enablement, conversions (visitors to customers), cloud technology, cognition (analytics), cohesion (integrating all the systems),  consulting and completeness (connecting brand experiences) across all channels. 

BORN has a unique approach to our work, founded on planning and insight development. We take time out to understand the brand, the business objectives and, most importantly, the customer before making recommendations for how we will execute on our strategy.

Passionate about the work they do, they have built a reputation on the high quality of their thinking, planning, delivery and client satisfaction. With offices in New York, London and Chennai, its global  clients, past and present, include: DKNY, RedBull, TAG Heuer, Lorna Jane, Razer, MacKenzie & Childs, Ferragamo, Alex & Ani, Jay Strongwater, DVF, Sothebys, Textron, Maxim Semiconductor, Lennos, Big Bus Tours,  Skullcandy, M&S, Salvatore Ferragamo, Fossil Group, and LVMH amongst others.",http://www.borngroup.com,"['ecommerce', ' creative', ' digital', ' agency', ' creative', ' cms', ' php', ' technology', ' web', ' fashion', ' retail', ' consulting', ' integrations', ' content', ' omnichannel', ' conversions', ' analytics', ' cloud', ' b2b', ' b2c', ' b2b2c', ' manufacturing', ' distribution', ' cpg', ' java', ' SAP', ' Demandware', ' Salesforce', ' Hybris', ' Magento', ' Big Commerce', ' IBM', ' Watson Commerce ', ' Acquia ', ' Drupal', ' Project Management', ' Software implementations ', ' Digital Transformation ', ' Order Management', ' PIM/DAM', ' and CRM']"
115,Capterra,Internet,Arlington,VA,76,Privately Held,"At Capterra, we believe software makes the world a better place. That's why we love connecting buyers and sellers of business software. Our website shows companies all of their options, regardless of what type of software they need, and we provide free advice and guidance to help them make the right decision.",http://www.capterra.com,"['business software', ' online marketing', ' b2b lead generation', ' enterprise technology', ' software reviews', ' business software reviews', ' and small business software']"
116,Alto Data Analytics,Internet,Madrid,Madrid,61,Privately Held,"Alto Analyzer is software that processes thousands of digital sources and offers immediate insight by organizing that content visually. We create clarity out of the chaos of digital noise, enabling organizations to make decisions that matter.",http://www.alto-analytics.com,"['Algorithms', ' Machine Learning', ' Augmented Intelligence', ' Data Science', ' Public Debate Analysis', ' Strategy Tool', ' Business Intelligence', ' Market Landscapes', ' Competitive Analysis', ' and Marketing and Advertising Analysis']"
117,Alexa.com,Internet,San Francisco,CA,76,Public Company,"Information is power - if you have the right tools. Alexa's suite of intuitive analytics products transforms data into meaningful insights that lead to competitive advantage for your company.

At Alexa, we focus exclusively on delivering the richest and most meaningful analytics tools for our customers. Our obsession is to empower customers through compelling and actionable insights that drive measurable results for their business. At Alexa, we believe strongly in substance over style, which means you can count on getting the exact insights you need without having to navigate through extraneous content to get the information you need right now.

Founded in 1996, Alexa is a global pioneer in the world of analytical insight. Our vast experience means we've dealt with all of the pitfalls and tripped over all of the landmines, and over time, developed the most robust and accurate web analytics service of any provider.

As a wholly-owned subsidiary of Amazon.com, a career at Alexa provides an extraordinary opportunity to work in a fun and challenging environment while enjoying the stability and rewards of working for an established corporation. 

Check out our careers here: http://www.alexa.com/about/careers",http://www.alexa.com/,"['web analytics', ' competitive analytics', ' SEO', ' SEM', ' competitive intelligence', ' site comparisons', ' keyword research', ' and site performance audit']"
118,Bitly,Internet,New York,NY,188,Privately Held,"We optimize the link so marketers can own their customer experience.

Since 2008, we have been committed to optimizing the link so marketers can own the customer experience. Bitly Enterprise - branded links, mobile deep linking, omnichannel campaign tracking, audience intelligence - gives the world's leading brands a holistic, unbiased view into an increasingly complex digital landscape, and a powerful way to see, control and own their customer experience across the internet. 

We are headquartered in New York City, with offices in San Francisco and Denver, and are trusted by leading brands like IBM, eBay, Nike, GE, BuzzFeed and thousands more.",http://bitly.com,"['internet', ' URLs', ' data', ' links', ' social publishing', ' social media', ' Twitter', ' Facebook', ' tracking links', ' analytics', ' social media monitoring', ' social media analytics', ' and analytics']"
119,Chartbeat,Internet,New York,New York,77,Privately Held,"Chartbeat, the content intelligence platform for publishers, believes that today’s content creators need mission-critical insights – in real time and across desktop, social, and mobile platforms – to build a loyal audience. That’s why our software goes beyond clicks and pageviews so content creators can understand what, within their content, is keeping people engaged. Partnering with over 60,000 media brands across 60+ countries, Chartbeat’s tools help the world’s leading media companies understand, measure, and build business value from the attention earned by their content.

We're constantly on the lookout for talented and energetic folks to join our Chartteam in our growing-every-second Manhattan office. See all of our current Chartteam members at chartbeat.com/about, and check out available job openings right here on this company page and on chartbeat.com/careers.",http://chartbeat.com,"['web analytics', ' real-time data', ' engagement', ' traffic', ' data science', ' audience development', ' video analytics', ' publishing', ' and viewability']"
120,"Simply Measured, A Sprout Social Company",Internet,Seattle,WA,87,Privately Held,"We pioneered the practice of social analytics and we're leading data-driven social marketing. In 2017, we became a Sprout Social company. We help marketers improve results and reach business goals through end-to-end social analysis and insights.",http://simplymeasured.com,"['social media marketing', ' social media analytics', ' twitter analytics', ' social media measurement', ' social media reporting', ' analytics', ' social media', ' and digital marketing']"
