,Company Name,Industry,City,State,LIEmployees,Company Type,Description,Website,Specialties
0,Rescale,Information Technology and Services,San Francisco,CA,74,Privately Held,"Next-generation, innovative engineering.  Your ideas aren't limited.  We believe your resources shouldn't be either. 

Rescale (www.rescale.com) provides the largest, most secure, global HPC footprint seamlessly integrated into an easy-to-use platform built for engineers and scientists.

We are always hiring great talent: www.rescale.com/careers

Rescale partners with industry-leading software vendors to provide instant access to a variety of simulation packages while simultaneously offering highly secure, customizable HPC. With platforms optimized for specific workloads, users are able to maximize their resources in an environment that is tailored to their CAE simulation needs. Rescale offers three platforms:

ScaleX Enterprise: Developed with both engineering and IT in mind, enterprise companies use ScaleX Enterprise to transform their IT from rigid on-premise hardware to a flexible, scalable HPC environment with a robust administration portal, remote visualization, and HPC integration capabilities. 

ScaleX Pro: This platform is designed for independent professionals and SMBs to perform complex simulations with increased speed and performance. The platform can be deployed to any organization within minutes. 

ScaleX Developer: This platform is designed for external application developers and software vendors to build, test, and deploy software directly to Rescale's platforms using Rescale's powerful backend. 

Rescale is located in San Francisco and works with users in the aerospace, automotive, energy, life sciences, construction, marine, consumer products, and manufacturing industries.",http://www.rescale.com,"['High Performance Computing', ' Simulation', ' Computational Fluid Dynamics', ' Finite Element Analysis', ' Optimization', ' Design of Experiments', ' Cloud Computing', ' HPC Cloud', ' HPC', ' Engineering', ' Computer Aided Engineering (CAE)', ' and Remote Visualization']"
1,"Ishpi Information Technologies, Inc. (DBA ISHPI)",Information Technology and Services,Mt. Pleasant,SC,217,Privately Held,"ISHPI works in concert with other defenders of the Homeland to fortify national preparedness, agility, strength and advantage in the cyber domain – a readiness state we refer to as an Holistic CyberStance™.  Using our integrated Holistic™ service solutions fortified with CyberSmithed™ and ActiveDefense™ processes, we weave the armor and forge the weapons that enable our clients to maintain a dominating Holistic CyberStance™ – always ready to Anticipate, Defend, Exploit and Attack in the Cyber domain.  Our Information Operations, Advanced Information Services, C5ISR Engineering & Technical Services, and Training & Consulting business units work in unison to provide experienced people, proven processes, technology, advice and leadership to enable full spectrum Cyber capability.

ISHPI was born a cyber-services company supporting U.S. Armed Forces personnel and other direct defenders of the homeland with a heavy focus on emerging asymmetric Information Operations.  Our focus on cyber related services has held steady while our client base and functional capabilities expanded exponentially to envelop essentially all cyber impacted components of modern warfare.  Philosophically, our approach to cyber surety has evolved to become Holistic in nature, based on a firm conviction that cyber activities are never truly secure unless every layer of the OSI model and every human input associated with the activity is Holistically engineered and integrated for cyber security.

In 2014 ISHPI acquired Advanced Information Services Inc., a globally recognized leader in Software Development Quality and the winner of the 2013 Government Information Security Leadership Award for secure software lifecycle practices and the IEEE Computer Society Software Process Achievement Award.  The acquisition added CMMI Maturity Level 5 Cyber-Secure Software Development to ISHPI’s Holistic CyberStance™ Strategy.",http://www.ishpi.net,"['Full Spectrum Cyber', ' CMMIDEV/5 Software Engineering', ' Intelligence & Counterintelligence', ' Counterterrorism', ' System Engineering & Integration', ' Red Teaming & Wargaming', ' Cyber Cert Training & Consulting', ' (ISC)2 Official Training Provider', ' and C5ISR Engineering & Tech Srvc']"
2,Clinical Computer Systems Inc.,Information Technology and Services,Elgin,IL,118,Privately Held,"Since inception, Clinical Computer Systems, Inc. (CCSI) has focused in the obstetrics field with its innovative software: the OBIX Perinatal Data System.

OBIX is a strategic perinatal software solution that meets the increasing demand for scalability and adaptability within enterprise infrastructures and interoperability with the hospital EHR.  These are the characteristics that hospital leadership consider when choosing a vendor to meet their financial goals, strategic initiatives for integration, and clinical acceptance.

To provide the best possible clinical support, CCSI collaborates with medical experts including; pioneering the clinical decision support, E-Tools with renowned expert, Lisa Miller, CNM, JD.

Additionally, highly rated software services, from clinical education backed by the OBIX University programs to dedicated technical customer service, regularly exceed expectations.

CCSI partners with industry leading organizations to further deliver a portfolio of solutions for legacy data retirement, EHR integration, and medical mobility.",http://www.obix.com,"['Health Care', ' Perinatal', ' OB', ' Obstetrics', ' HIT', ' Hospital Information Systems', ' Electronic Fetal Monitoring (EFM)', ' EHR for Labor and Delivery', ' and Electronic Fetal Surveillance Software']"
3,HCST,Information Technology and Services,Beavercreek,OH,136,Privately Held,"HCST is the “Business IT Services Partner” for companies in the Dayton / Springfield Ohio area. HCST provides a full range of  IT services, and has positioned itself as a single source for anything IT related, including support services,  computer workstations, servers, local network, Internet access, web hosting, email,  voice services and network-enabled phone systems.  HCST specializes in working  s with small to mid-size companies, where HCST becomes the “IT Staff” for the organization.

Specific IT Services include: Managed Support services; traditional hourly IT Support; Internet access; web hosting (shared and dedicated), email services; Co-Location; Hardware / Software sales through vendors such as Dell, IBM, Lenovo, Cisco, Microsoft, TrendMicro and others; and Voice-over-IP Phone systems and services.

HCST has a staff of full-time support technicians who provide both remote and on-site technical support and consulting services.

HCST is a registered  tradename for Hassler Communication Systems Technology, Inc; a privately held corporation registered in the state of Ohio doing business since 1991.",http://www.hcst.net/,"['Business IT Services', ' Microsoft SBS', ' Asterisk', ' Managed Support', ' and linux']"
4,Magellium,Information Technology and Services,Ramonville Saint-Agne,Midi-Pyrnes,147,Privately Held,"Founded in 2003 in Toulouse, Magellium is a French tech company of 140+ employees dedicated to digital geography and image processing mainly involved in Defense & Security, Space, Energy & Environment sectors. Technical teams are divided into two production sites in Toulouse (head office) and Paris (92 - Courbevoie).

Magellium has a recognized expertise in earth observation, geographic information systems, mapping technologies and vision based systems. Magellium offer includes consulting, technical & scientific studies, software & IT system development and software product distribution.",http://www.magellium.com,"['Earth Observation', ' GIS', ' Mapping', ' Geo Intelligence', ' Computer vision', ' Robotics', ' Imaging', ' Software development', ' System integration', ' Geo Information', ' Defence', ' Space', ' Energy', ' and UAV']"
5,Unicom,Information Technology and Services,Lincoln,RI,521,Privately Held,"UNICOM, a division of Custom Computer Specialists, is an IT services consultancy that provides technology solutions to corporate, education, government, and healthcare clients throughout New England. We're a team of analysts, technology architects, developers, project managers, engineers and technicians working together across software and hardware disciplines.",http://customonline.com,"['Managed Services', ' Virtualization', ' IT Optimization', ' Application Development', ' and SharePoint']"
6,Sky-Futures,Information Technology and Services,Hayes,Middlesex,29,Privately Held,"The Sky-Futures mission is to improve safety and reduce risk across industries by enabling enterprises to harness the power of drone-driven data collection, analysis and storage. 

Since 2009, Sky-Futures has established itself as the world’s leading provider of drone-based inspection services to the global industrial markets. This expertise, operational knowledge and experience have been employed to develop ground-breaking software, sensor and technology solutions for the drone-based industrial inspection market. This leading-edge technology is being used today by clients looking to harness the power of drone-driven data collection and analysis.

Since 2009, Sky-Futures has established itself as the world’s leading provider of drone-based inspection services to the global industrial markets. This expertise, operational knowledge and experience have been employed to develop ground-breaking software, sensor and technology solutions for the drone-based industrial inspection market. This leading-edge technology is being used today by clients looking to harness the power of drone-driven data collection and analysis.

Sky-Futures’ end-to-end enterprise solutions including training packages, services and software solutions enable enterprises to perform safe and cost-effective drone inspections of a variety of vertical infrastructures, including but not limited to the following industries: Oil and Gas; Renewables; Utilities; Telecoms; Bridges; and Construction.

We also offer data analytics and reporting software for drone-based industrial inspections with EXPANSE, an asset inspection platform that allows enterprise to visualise and analyse all data, from static imagery captured with mobile devices or drones, to historic engineering reports or photogrammetry models. By exploiting the unique characteristics of Drones, Artificial Intelligence and Computer Vision, we help engineers and inspectors to get smarter data with advanced and highly automated tools.

Sky-Futures has customers in the UK, Europe, South East Asia, Middle East, North America, and Africa. The business is headquartered in London with offices in Houston, TX in the USA, Kuala Lumpur in Malaysia, Abu Dhabi in UAE and Aberdeen in Scotland. 


www.sky-futures.com",http://www.sky-futures.com,"['Drone-driven data analysis & collection software', ' End-to-end drone-based enterprise solutions', ' Drone-based industrial inspections', ' Commercial Remote Pilot Training', ' Emergency Services Training', ' Rapid Response Service', ' and Safety Overwatch Service']"
7,Emergent Systems,Information Technology and Services,Dearborn,Michigan,50,Privately Held,"""Inventors... Builders... Problem solvers""

Emergent Systems is a global engineering services and technology company serving the Automotive, Aerospace and Consumer Products industries since 1999.
Headquartered in Dearborn, Michigan, Emergent develops Auros, a first of its kind,  Enterprise Knowledge Management  software solution  that propels engineering intensive companies into next generation Knowledge Aware Processes.
Emergent Systems helps engineering and manufacturing companies design and engineer new products. We love to develop new products for ourselves and our customers. We also assist inventors by bringing their ideas to life through feasibility, design, engineering and creative problem solving.
We use a broad suite of computer tools and technologies including CAD and CAE/FEA tools to develop 3-D models of products and perform functional simulation to perform virtual testing for stress and strength using structural analysis, as well as perform fluid flow and thermal analysis using CFD tools. Our technical staff includes designers and engineers, who are familiar with tools such as Catia, UG NX, ProE, SolidWorks, AutoCAD, Ansys, Nastran, Moldflow and others.
We work on automotive products, as well consumer goods and industrial products. We deploy stringent engineering standards, and are familiar with quality and testing protocols prevalent in the the engineering manufacturing industry.
Working with us will surprise you!
.",http://www.emergentsys.com/,"['CAD CAE PLM  Automotive Aerospace ""Knowledge Management""', ' Design Engineering', ' KM ""Knowledge Management""', ' Automotive Aerospace Consumer goods', ' Inventions', ' and New Product Development']"
8,Waveaxis Technologies,Information Technology and Services,Plano,TX,43,Privately Held,"Waveaxis Technologies Pvt. Ltd. is a leading software company providing services pertaining to Internet of Thing, Computer Vision, Machine Learning, Cloud computing, Mobile and Web Application and software development services. 

Additionally, we also design and develop Image Processing Libraries, standalone API’s for machine vision, robotics integration, CAD/CAE engineering software's and Encryption/Decryption tools.
 
Founded in 2003, Waveaxis has successfully completed several projects with varying complexity and applications for clients worldwide.",http://www.waveaxis.com,"['Computer vision', ' Quality Assurance for industrial components', ' Internet of Things', ' Software Development life cycle', ' CAD/ CAE Specialization', ' and Encryption/ Decryption Tools']"
9,JBA International,Information Technology and Services,Pasadena,CA,57,Privately Held,"JBA is a 30 year old company leading the way for the future of business. Whether it’s employer branding, digital marketing, or corporate training, we specialize in connecting talented, or executive search. Though we work in most industries and areas, we specialize in high-tech, legal, administrative, financial and marketing talent. 

Our Offerings:

JBA has four main services: Consulting, corporate training,  digital marketing, and Executive Recruitment. 

Consulting | We provide solutions to meet companies’ project, whether they need immediate help, or someone to work through a project from conception to implementation. 

Corporate Training | We work with subject matter specialists to create winning instructional design. 

Executive Recruitment | We work with leading executives globally in connecting them with opportunities for the right companies.

Digital Marketing | We work with medium size companies managing their digital media process for them.

Our History: 

JBA was founded in the 1988  by a female computer scientist who saw a market for supporting companies through building a consultancy. Thus, Jacqueline Buickians and Associates (JBA) was formed. 

Throughout the years, demand set in for other offerings and we expanded our services in these area. We increased the variety of staff for different positions, expanding our company focus from technology to fields like accounting, legal, marketing, administrative, and most recently, executive recruitment. 

Today, JBA provides services beyond consulting, supporting companies with creative services like digital marketing, employer branding, and training. Our services add value to our clients in this evolving global market.",http://www.jba.com,"['Talent Acquisition Management', ' Staff Augmentation', ' Staffing', ' Consulting Services', ' Temp Staffing', ' Legal Jobs', ' IT Jobs', ' Administrative Jobs', ' Accounting Jobs', ' Finance Jobs', ' Staffing Firm', ' Hiring', ' Employment Agency', ' IT Consulting and Services', ' and Software Development']"
10,TestPro LTD (AllStars-IT Group),Information Technology and Services,Ramat Gan-Benei Braq,Center.,16,Privately Held,"Staffing is our Profession Since 2004!
AllStars-IT is a leading Israeli software house providing end-to-end IT services,a range of solutions for international companies and leading organisations. We employ hundreds of IT experts in Israel, and Low Cost-Off Shore software experts located in Kiev-Ukraine.

The group has four Centres of Excellence: 
1. The Consultants Division - AllStars-IT Israel : Software engineers selected in a unique process carried out by engineers from the industry. We employ: Software Developers, Software Testers and Quality Assurance Experts, Communication Engineers, Information Security and Cyber,Cloud Computing Experts,Algorithm Experts,Experts in Databases & Big Data,System Engineers and Project Managers.Our Headquarters are Located at B.S.R Tower 23rd Floor- at the heart centre of Israel.

2. The OffShore Division - AllStars-IT Ukraine:Provides leading Engineers and IT experts at the highest levels, with proven experience, academic education among the best in Eastern Europe and with mentality of responsibility and Quality. Our Ukrainian headquarters are Located at the heart centre of Kiev Ukraine-at ""Guliver Business Centre""?.

3.The Testing Division - TestPro : Provides advanced solutions for software and testing projects, consulting on quality assurance, automated testing and-Performance, manual testing of computer systems of various types, configuration management and control, staff training, audit and certification for international standards.

4. The Information Security Division - CyberStars : We conduct Risks surveys,PT-Penetration Testing, Disaster and recovery Plan .Cyber Stars provides consultants, Cyber Room, tests hardening infrastructure, For network and computer systems. Our advanced CYBER Room located near the company's offices in the North.

Among our clients are: Banks, Insurance Companies, Government Offices, Ministry of Defense Offices, Armies, municipalities, Telecommunications and Hi-Tech Leading Companies.",http://www.allstars-it.com,"['Software and Hardware Testing and Development Services', ' Mobile Application Design and Development', ' Cyber Security Services (We Deliver ""Cyber Room""\u200b Services)', ' Off Shore Low cost Development and Testing services', ' software development', ' and offshore Low Cost']"
11,CIPS (Canadas Association of Information Technology Professionals),Information Technology and Services,Mississauga,Ontario,27,Nonprofit,"CIPS is a professional association of individual IT professionals. Since 1958 CIPS has helped strengthen the Canadian IT industry by establishing standards and sharing best practices for the benefit of individual IT professionals and the sector as a whole. As Canada’s Association of Information Technology Professionals we represent thousands of members across the country.

CIPS offers Networking opportunities, Certification of IT professionals (I.S.P. and ITCP certifications), Accreditation of IT Post-Secondary programs, a niche IT Job Board, a voice to government, and represents Canadian IT professionals in international forums, encouraging and facilitating on-going professional development and safeguarding the public interest.

http://www.cips.ca


Some CIPS programs: 

CIPS Certification:
Recognizes leaders within the IT Profession http://www.cips.ca/certification

CIPS Accreditation: 
Accreditation of computer science, software engineering, and MIS programs in Canadian colleges and universities http://www.cips.ca/accreditation
.",http://www.cips.ca,"['professionalism', ' standards', ' ethics', ' education', ' outreach', ' services', ' support', ' advocacy', ' certification', ' accrediatation', ' and best-practices']"
12,ZOLOZ,Information Technology and Services,Kansas City,MO,43,Privately Held,"We make it simple to be known, trusted and safe in the digital world by offering biometrics-based solutions to replace PINs, passwords and offline identity verification.

ZOLOZ is the result of the combination of biometrics and authentication expertise from Ant Financial and EyeVerify, which Ant Financial acquired in 2016. Today, ZOLOZ has 120 employees in China, Singapore and the United States. Over 200 million people worldwide use ZOLOZ’s technology, and with the launch of a comprehensive, hosted-identity platform, the company intends to make trust simple for billions of people in generations to come.",http://www.zoloz.com,"['Biometrics', ' Security', ' Mobile Security', ' Image Processing', ' Computer Vision', ' Software Engineering', ' Research', ' Computer Software', ' Fintech', ' Pattern Recognition', ' Machine Learning', ' and Deep Learning']"
13,Fast-teks On-Site Computer Services,Information Technology and Services,Tampa,FL,124,Privately Held,"In today's world of computer technology, individuals and companies depend on fast reliable services. Fast-teks offers a full range of IT solutions to meet your entire home and business needs. Our highly trained staff provides professional, high-quality service at affordable rates in the comfort and convenience of your business or residential location. 

Fast-teks is a leading on site computer services company. Our technicians, trainers and website developers have helped thousands of small businesses and homeowners with their computer needs.

Fast-teks provides fast, affordable solutions to residential clients. 
Our certified technicians can provide service direct to your home on the same day you call, including weekends and evenings. Let us take care of all of your computer repair and service needs! Click on a link below to find out more about our specific residential service offerings.

Why Choose Fast-teks for Business Services?
Fast-teks business services are designed with small and mid size businesses in mind. Our certified technicians provide fast, affordable business computer service and technical computer help - offering same day, weekend and evening appointments. We work with all of our clients to ensure they have the right hardware and software to meet their company's needs.  Let us be your IT department for a fraction of the cost!",http://www.fastteks.com,"['Computer Service', ' Computer Repair', ' Outsourced IT', ' and Computer Networking']"
14,"Apex Computer Systems, Inc.",Information Technology and Services,Cerritos,California,127,Privately Held,"About Apex Computer Systems, Inc.

Apex Computer Systems, Inc. (ACSI) is a leading provider of hardware, software and service solutions for the Integrated IT stack. The company’s Consulting Solutions Group partners with top tier providers to enable organizations to seamlessly and cost-effectively implement solutions to manage business-critical applications for finance, supply chain, and operations. ACSI’s Field Services Group offers scalable and flexible full lifecycle support including hardware and software deployment, maintenance, upgrades, logistics, provisioning and service desk. Founded in 1983, ACSI is a time-tested ISO 9001-compliant organization helping companies meet their present and future IT business needs and challenges. Apex Computer Systems works with top tier F500 companies to provide solutions and services to enterprises, government agencies, financial institutions, SMEs, higher education, and managed service providers. For more information, please visit http://www.acsi2000.com.",http://www.acsi2000.com,"['IT Lifecycle Maintenance Services', ' ERP', ' Help Desk Support', ' Microsoft Dynamics NAV', ' Cloud Services', ' Data Center Services', ' Office 365', ' 3PL', ' and Windows Intune']"
15,Saratoga Technologies,Information Technology and Services,Johnson City,TN,95,Privately Held,"We are completely different than the average technology company. We don't want to sell you ""stuff.""? We want to add value to your organization by reducing your current costs, improving your efficiency through process optimization and protecting your equipment and data.

Our team has years of combined experience in the technology industry which means you don't have to know it all or do it all. We have encountered a wide variety of problems and provided solutions in every type of industry. Saratoga Technologies, Inc. has provided business, medical, academic and other clientele with computer hardware, networking services, printing solutions, software and communications services for more than a decade. 

Saratoga Technologies is recognized as the premier technology solutions company in East Tennessee and Southwest Virginia, with offices in Johnson City, Knoxville, and Chattanooga, TN and Abingdon, VA. The combination of our four technology divisions including: Networking, Printing, Communications, and Business Solutions ensures Saratoga Technologies is capable of providing all sizes of organizations with virtually all their technology requirements. We emphasize superior customer service built on the foundation of technical expertise. We have a team of professionals who enjoy their work and it shows. 

We want to become your trusted technology advisor and partner of choice.",http://www.saratogaus.com,"['computer networking', ' website design', ' software development', ' printer / copier repair', ' and telephone systems']"
