,Company Name,Industry,City,State,LIEmployees,Company Type,Description,Website,Specialties
58,GE Transportation,Transportation/Trucking/Railroad,Chicago,IL,5493,Public Company,"At GE Transportation, we move the world. We are a global digital industrial leader and supplier to the rail, mining, marine, stationary power and drilling industries. Our solutions help customers deliver goods and services with greater speed and greater savings using our advanced manufacturing techniques, industry expertise and connected machines.
 
Established more than a century ago, GE Transportation is a division of the General Electric Company that began as a pioneer in passenger and freight locomotives. That innovative spirit still drives GE Transportation today.

It's the engine of change that puts us at the forefront of transportation technology, software, and analytics. And it's why we continue to find-and realize-the potential that keeps our connected world moving forward.
 
The GE Transportation Global Headquarters is located at 500 W. Monroe St. Chicago, IL 60661 USA. There are over 65 service sites worldwide.
 
For more information, visit www.getransportation.com.",http://www.getransportation.com/,"['Rail Services', ' Mining', ' Marine', ' Drilling', ' Stationary Power', ' RailConnect 360', ' Locomotives', ' and Digital Solutions']"
59,Cubic Transportation Systems,Transportation/Trucking/Railroad,San Diego,CA,751,Public Company,"At Cubic Transportation Systems, we believe that to take the right path, you sometimes have to create it. That’s why, even though we helped revolutionize the transportation industry, we’re dedicated to reinventing it.

We are the leading integrator of payment and information solutions and related services for intelligent travel applications. Cubic delivers integrated systems for transportation and traffic management, delivering tools for travelers to choose the smartest and easiest way to travel and pay for their journeys, and enabling transportation authorities and agencies to manage demand across the entire transportation network – all in real-time.

Every year, more than 24 billion transportation payment transactions are processed using Cubic payment and information systems worldwide. Cubic has delivered over 20 regional back office operations which together integrate over 450 transport operators and serve over 38 million people every day in major markets around the world.",http://cubic.com/transportation,"['Traffic Management', ' Revenue Management', ' Fare Collection', ' Tolling', ' Data and Analytics', ' Real-Time Passenger Information', ' Mobile', ' Transport Ticketing', ' Mobility as a Service', ' RTPI', ' and NextBus']"
60,Trucking Advantage LLC,Transportation/Trucking/Railroad,Dallas,TX,47,Privately Held,"Trucking Advantage is a mobile software producer and online resource, seeking to empower new and existing trucking companies to be successful by providing technological solutions, easily accessible information, and value-added services. Visit us on the web or follow us on Twitter to find out more.",http://www.truckingadvantage.com,"['Start a trucking business', ' government compliance', ' operations management', ' computer technology', ' sales', ' marketing', ' financial', ' small business consulting', ' and mobile software']"
61,Ingram Micro Lifecycle Services,Wireless,Plainfield,Indiana,1345,Public Company,"Ingram Micro Mobility enables the world’s most prominent technology equipment manufacturers, carriers, network operators and retailers to navigate smoothly through the complexities of the wireless industry, helping them capture market share and realize greater profitability. As a leading provider of wireless device lifecycle services, the company delivers a strategic suite of end-to-end supply chain and customization solutions that help customers:

•	Expand into new channels and markets for increased profitability,
•	Achieve faster responsiveness and greater flexibility to drive customer satisfaction, and 
•	Lower cost structure to ensure greater efficiency.

Ingram Micro Mobility’s position at the center of the mobile ecosystem provides customers with unique industry access and expertise at every phase of the device lifecycle. The company’s multi-disciplinary collaboration of planners, transportation and warehouse managers, industrial and software engineers, and finance teams helps create the optimal mix of services and solutions for each customer. This ranges from basic warehousing to software loading, order and accounts receivable management to end-user fulfillment, and reverse logistics, including wireless device repair, refurbishment and recycling services.

Formerly known as BrightPoint, Ingram Micro Mobility became a wholly-owned Ingram Micro Inc. subsidiary in 2012. Ingram Micro Inc., a Fortune 100 company serving more than 200,000 resellers, is the world’s largest wholesale technology distributor and a global leader in IT supply-chain, mobile device lifecycle services and logistics solutions.

For more information on Ingram Micro Mobility, visit ingrammicro.com/mobility, Twitter at Twitter.com/IM_Mobility or Facebook at Facebook.com/IngramMicroMobility.",http://www.ingrammicro.com/mobility,"['Device Lifecycle Services', ' Third Party Logistics', ' Supply Chain Management', ' and Device Recovery Services']"
62,Android Headlines / AndroidHeadlines.com,Wireless,Valencia,CA,28,Privately Held,"Android Headlines has been one of the leading sources of Android news for the android community since 2010. We provide the most comprehensive Android news coverage and in-depth reporting of the Google’s Android Platform, Phones, Tablets, Applications, Reviews and mobile focused technology information. Android Headlines works closely with Google and it’s partners to bring all the latest Android news, product information and community content to an audience of over one million monthly readers.

Our writers are tech lovers and expert users with a passion for Android. They help shape the industry with their in-depth coverage of Android news to the Android Community and it’s followers. We strive to bring the most compelling and accurate Android news, analysis, opinion and provide our readers with the most detailed information in the industry with the highest standards and ethics in journalism.",https://www.androidheadlines.com,['Android News and Commentary']
63,Meru Networks,Wireless,Sunnyvale,CA,318,Public Company,"Meru's innovative approach to wireless networking uses virtualization technology to create an intelligent and self-monitoring wireless network. With Meru, enterprises can become all wireless, smoothly migrating their business-critical applications from wired to wireless networks.

With Wi-Fi from Meru, organizations can:

•	 Deal with increasing capacity demands 
•	 Deploy and manage their wireless network easily
•	 Deliver consistent, high-quality mobile services 
•	 Manage the network efficiently and cost-effectively
•	 Ensure business applications run reliably over the network 
•	 Provide secure access for all users and guests
	
Meru's solutions have been adopted in all major industries, including Fortune 500 enterprises, healthcare, education, retail, manufacturing, and hospitality.. Founded in 2002, Meru is headquartered in Sunnyvale, California, and has operations in the Americas, Europe, the Middle East, and Asia Pacific.",http://www.merunetworks.com,"['802.11ac Wireless LAN network solutions including wireless access points', ' Wireless network management software', ' WLAN controllers', ' Wireless security applications', ' Wireless guest management applications', ' and SDN Solutions']"
