,Company Name,Industry,City,State,LIEmployees,Company Type,Description,Website,Specialties
62,Arab Sea Information Systems,Information Technology and Services,Riyadh,Riyadh,65,Partnership,"Arab Sea Information Systems Saudi joint stock company specialized in the production of computer programs for commercial and governmental organizations, also provide solutions, information systems and government projects implementation in the IT sector. Headquarters located  in Riyadh, capital of Saudi Arabia and has branches in Jeddah, Dammam, buraydah, Khamis mushait and Madena. also the company has agents in each of Syria, Sudan, Yemen, Jordan, Egypt, Libia and India.",http://www.arabsea.com,"['Software', ' Network', ' Accounting', ' and Hardware']"
63,Autocab Brasil,Information Technology and Services,So Paulo,SP,35,Privately Held,"Autocab é o fornecedor número um de sistemas de despacho e gestão de táxi no mundo. Nosso primeiro sistema foi vendido em 1991, desde então a Autocab cresceu para se transformar no maior fornecedor de sistemas de gestão e controle de corridas do mundo. Suas soluções SaaS baseadas na nuvem, sob medida, ajudam no sucesso e crescimento de mais de 1500 empresas de táxi em todo o mundo.
Mais de 25 anos de pesquisa e desenvolvimento e empenho junto as empresas de táxi inspiraram nosso sistema a sempre garantir o que há de melhor em sistema de gestão e controle de corridas no mercado. Com sede em Manchester, Reino Unido nossos clientes estão localizados em todo o mundo. Além do nosso principal produto Ghost, desde então ampliamos nossa gama de serviços para incluir desde aplicativos com a marca de características de cada empresa de táxi, gestão de análises, sistemas de telefonia sob medida, bem como uma gama de soluções de mídia social e web para empresas privadas de táxi, associações cooperativas, limusines e controle de transporte terrestre de todos os tamanhos e categorias.",http://www.autocabbrasil.com.br,['Computer Software']
64,Sinewave Computer Services Pvt. Ltd.,Information Technology and Services,Pune,Maharashtra,123,Privately Held,"Sinewave Computer Services Pvt. Ltd.(ISO 9001:2008) is a 32+ years software development company based out of Pune India, Catering to 15000+ customer base across India. Sinewave is a well known brand in providing high quality and reliable software solutions for Taxation in India and HR Management.
We serve to a comprehensive customer base right from Individuals to SMEs. Our clientele includes Chartered Accountants (CA’s), Cost Accountants (CWA’s), Tax Consultants, Educational Institutions, Co-operative Societies, Banks, Service Industry, Small and Medium Scale (SME) industrial sector and many more.
Our products are competitively priced and have helped our customers achieve immense value addition and evolve in their professional life. Our Technology Innovation and Delivery Innovation initiatives ensure that our clients are constantly equipped with solutions to meet emerging opportunities and threats.",http://www.sinewave.co.in,"['Market Leaders in Taxation Software industry.', ' HR Management Software.', ' Taxation Service Provider', ' and Digital Signature Certificate Provider.']"
65,Global Engineering Technologies,Information Technology and Services,Belgrade,Serbia,110,Partnership,"Global Engineering Technologies – GET is Serbian based company founded in 2007 with headquarters in Belgrade and is recognized as a reliable ISV and IT outsourcing company on the international market. We are specialized in software development and IT outsourcing services and are one of the fastest growing IT companies in SEE with Microsoft, Atlassian, Cisco partner status. GET is present on important industry IT conferences and public events in the region.

We are innovators, engineers, designers and project managers who work with clients to produce great results in their businesses. On the top of that, we are also original thinkers who create new business models in partnership with our clients.

GET has the capacity of more than 100 software engineers, business analysts and business domain experts.

Our company works with clients ranging from 5 to 80 thousand employees. With our partners, we participate in projects for some companies with more than 300 thousand employees. Our business domains are mostly focusing on automotive industry, banking and financial services, logistics and the retail industry.

GET is recognized as a reliable partner of Atlassian, Microsoft and Cisco.",http://www.global-engineering-technologies.com,"['Software development', ' Computer Aided Design', ' PLM', ' and Network administration']"
66,Techvedic,Information Technology and Services,Las Vegag,Nevada,105,Privately Held,"With a mission to “Simplify Information Technology for One & All”, Techvedic unfolds the deep layer of technology innovations to let home users and corporate businesses enrich their technology experience. Having five years of rich experience in technical support industry, Techvedic Technologies has become one-stop destination for all technology enthusiasts working on different platforms. The company leads with a team of well-experienced and certified IT professionals to serve worldwide clientele with tech support solutions along with data backup & recovery services, technology journalism, communication and & collaboration solutions, and online marketing services under the umbrella of its sister concern companies.

Since its inception in 2009, the company has spread its business shackles around the world, including the US, the UK, Australia and Canada, to make the technology derivatives more purposeful for home & business consumers. With flexible online and onsite tech support modules, Techvedic Inc. has served more than 75,000 worldwide clients, and the “XpertCrew” professionals have been successful in resolving 30,000 complex technical issues across various technology devices. Initially, the tech support vendor served clients via phone & email support, but later Techvedic team started delivering prompt in-home and in-store services to technology users at pocket friendly service charges. 

Presently, head quartered in New Delhi, India, Techvedic Technologies Pvt. Ltd. is working as a promising technology service provider in the industry to guide enthusiasts with recent industry trends through tech blogs, news and other useful information. Transparency, accountability and integrity have been the major success pillars at Techvedic.

With a work culture with 24 /7 and 365 days a year, the company takes care of every big and small client issues and address them in guaranteed least turnaround time.

Read more at http://en.wikipedia.org/wiki/Techvedic",http://www.techvedic.com,"['Computer hardware maintenance & support', ' Software support', ' New technology deployment', ' Remote office support', ' and The list doesn’t just end there', ' there is a lot more that we do.']"
67,The GBS Group,Information Technology and Services,Virginia Beach,VA,101,Privately Held,"The GBS Group is an engineering, technical and software services business focused on large marine, rail, defense and commercial assets. GBS improves reliability, performance, and longevity of assets by providing a disciplined approach to solving our client’s hardest problems.

The GBS Group specializes in reliability engineering, software application development, maintenance engineering and management, and technology insertion for wireless, health monitoring systems. We serve the passenger rail, defense, energy and construction markets, primarily. Our engineers, computer software professionals, and reliability consultants provide technology solutions that improve the bottom line for owners of complex systems.",http://www.thegbsgroup.us,"['Software Applications Development', ' Controls and Automation', ' Systems Integration', ' Software Architecture', ' Remote Monitoring of Locomotive Equipment', ' Satellite / GPS Systems Design and Installation.', ' and Field Service Engineering']"
68,"Rapidsoft Systems, Inc.",Information Technology and Services,Princeton Junction,NJ,21,Privately Held,"Rapidsoft Systems, Inc ( http://www.rapidsoftsystems.com ) is an outsourced software product development company based in Princeton, New Jersey with software development activities in the USA and India. We are a foremost outsourced software product company with expertise in Online Gaming Software, Web applications, Mobile Applications, CRM Software Solutions,ERP Software Solutions,Enterprise Applications Development, etc. Our team of engineers have executed over 350+ major projects amounting to over 1,200,000 effective hours in all areas for all kind of companies from individual start-ups to Fortune 500 businesses. 

Our Engineering management team has 300+ man years of experience with previously running major projects at world leaders like Alcatel, Motorola, Nokia, Lucent, Glenayre Technologies, Cisco Systems, Oracle EMC, Ennovate Networks, Corona Networks, Telstra, Intel, Toshiba and Matsushita (Panasonic). We have guided large and complex multi-million dollars Fortune 500 projects and created products with combined market values of Billions of dollars.

With a strong knowledge base and proven expertise in the areas of Wireless Internet, Web technologies, Mobile, P2P, Computer Networking and Infrastructure Development,CRM Software Solutions,ERP Software Solutions,our team is your ideal technology partner. Our ability to work on latest Web technologies, Mobile Networks and support multiple devices makes us immensely valuable to all our customers.

Key members of our Management and Engineering team have been at the technology industry forefront in managing the development of numerous successful products, and technologies for the wireless (GSM/CDMA infrastructure, Mobile Devices and applications), IEEE 802.11 WLANs, computer networking (IP Routers, VPN Gateways, Optical Switches), Media Streaming, P2P, SIP and Web 2.0 technologies (banking, insurance and manufacturing, Mobile applications).",http://www.rapidsoftsystems.com,"['Outsourced Product Development', ' Offshore Software Development', ' Customs Applications Development', ' Product Design& Development', ' Product Life Support', ' Mobile Applications and Systems Development', ' Database Redesign and Application/ Platform Migration', ' and OpenSource']"
69,Lyme Computer Systems,Information Technology and Services,Lyme,New Hampshire,30,Privately Held,"LYME COMPUTER SYSTEMS is a full-service computer products reseller with a focus on networking, networking security and interconnectivity. Although our primary market is the U.S. Government, we also address the needs of state and local governments, government contractors, corporations, and academic institutions. We hold two GSA Federal Supply Schedules, giving government customers open market or GSA Schedule procurement options. 

Our Corporate Mission is to be recognized as the premier IT solutions provider in the government and commercial markets by providing an unsurpassed mix of customer service and high quality products at the most competitive prices.

Established in 1983, Lyme Computer Systems, a 100% Employee Owned Company (ESOP) has earned many manufacturers certifications including: Cisco Premier Partner, Dell GSA Reseller, Hewlett Packard Preferred Partner (Enterprise StorageWorks for Federal), VMware Enterprise Partner and Apple Computer VAR, plus many others.",http://www.lyme.com,"['reseller', ' hardware', ' software', ' solutions', ' Dell', ' Cisco', ' HP', ' IBM', ' VMware', ' Mathworks', ' Solidworks', ' Dassault Systemes', ' Paraben', ' Tableau', ' Samsung', ' APC', ' Liebert', ' Belkin', ' Virtual CIO', ' Acme Packet', ' Core Security', ' Virtualization', ' Engineering', ' and Installation']"
70,Finch Computing,Information Technology and Services,Reston,VA,15,Privately Held,"Finch Computing provides our customers with the ability to find hidden meaning and insight in huge volumes of data. Streaming or static. Structured or unstructured. Internal or external.

We use our unique intellectual property and knowledge assets to offer compelling, differentiated data services that help our customers make better business decisions, identify risks and opportunities, or become more competitive.

It’s a whole new way of interacting with information.",http://www.finchcomputing.com,['Computer Software']
71,Laser Soft Infosystems Ltd.,Information Technology and Services,Chennai,Tamil Nadu,103,Privately Held,"Laser Soft is a software product company established in 1986 by Mr. Suresh B Kamath, an M.Tech in Computer Science from IIT, Chennai, with a focus on development of products for the Banking and Financial Service sector. The product offerings cover the entire range of Banking Operations and include Core Banking and quite a few specialized products like Treasury, Trade Finance, Cash Management, Recon systems etc.",http://www.lasersoft.co.in/,['BFSI']
72,Sentar Inc.,Information Technology and Services,Huntsville,AL,220,Privately Held,"Sentar is a privately held Women-Owned Small Business (WOSB) headquartered in Huntsville, Alabama focused on providing solutions that push the frontier of network centric systems.

Mission: In a connected world, cyber-attacks present a threat to every aspect of our society. Our passion is protecting our Nation’s Security and our way of Life, by  Innovating, Building and Securing Mission Critical Assets.

Corporate Focus: Delivering technology and services supporting network centric systems--We supply Technology solutions, Software solutions, and Information Assurance solutions that empower our customers to leverage the future of their network centric system today.

Corporate Capabilities: Sentar offers comprehensive commercial software development services, military and aerospace contracting, advanced research and development and consulting services supporting process improvement (e.g., CMMI) and business process engineering.  Sentar’s innovative research and development emphasizes software agent technologies that protect network and host computer resources from cyber attackers and malicious insiders.",http://www.sentar.com,"['Cyber Resilience / Cyber Mission Assurance', ' Cyber R&D', ' DoD', ' Industrial Control Systems', ' Healthcare', ' DHS Cyber Security', ' and Cyber Intel']"
73,Ikaria  IT Security Experts,Information Technology and Services,d,dzkie,31,Privately Held,"For more than 12 years Ikaria has been a Leader in the IT Security Industry and one of Poland’s fastest growing IT companies. 

What we do:

1.	ANTI VIRUS & MALWARE DEFENSE
Are you looking for the best security products for your company? 
We are #1 provider of Security Software in Poland. We offer products from both global leaders and niche market solutions. 
•	Antivirus Software - comprehensive protection for workstations and servers
•	Network Security - UTM, firewall, intrusion prevention system, gateway antivirus, content filtering
•	Email Security - desktop solutions, gateway antispam, mail server protection
•	Data Encryption and DLP - protection of sensitive data against unauthorized access and leakage

2.	KNOWLEDGE SHARING & ADVISING
Are you seeking an unbiased expert advice or help?
We have some of the best IT Security Experts aboard and 18 technical certifications (including CEH, CISA, CISSP). You can trust us – we know what we do.
Check our services:
•	Training Courses - network security, application security, Windows and Linux servers hardening
•	Systems Auditing and Security Testing - network and application audit, software licensing audit, data protection audit, penetration testing
•	Helpdesk Pro - 24/7 technical support line with guaranteed response time

3.	BUSINESS DEVELOPMENT
Are you looking for a Business Partner in Poland?
We have 16 gold and platinum partner statuses with the world’s largest IT security providers but we always look for new opportunities.",http://www.ikaria.pl,"['IT Security', ' Information Security', ' Computer Security Products', ' Anti Virus', ' Malware Defense', ' Enterprise information security architecture', ' Risk Management', ' Computer Security Policy', ' Information System Auditing', ' Security Testing', ' Firewall', ' CEH', ' CISA', ' and CISSP']"
74,EAC Product Development Solutions,Information Technology and Services,Burnsville,MN,98,Privately Held,"For more than 20 years, EAC Product Development Solutions has been transforming the way companies design, manufacture, connect to, and service their products. We work with companies to develop strategies, select solutions and platforms, implement enterprise and user toolsets, and adopt the solutions and ideas necessary to innovate, optimize, and win in the complex and competitive world of product development.",https://eacpds.com/,"['PLM', ' CAD', ' PDS', ' Product Development', ' Business Process Consulting', ' Consulting', ' Engineering', ' Product Development', ' Design', ' Engineering', ' Extensioneering', ' Lean Product Development', ' Learning First Product Development', ' Lean', ' Lean Enterprise', ' Process Consulting', ' product lifecycle management ', ' Product Development Services ', ' Implementation consultant', ' Instructor-led Training ', ' product development system assessment ', ' product data management ', ' product lifecycle management', ' Internet of Things ', ' Business development ', ' product development information services', ' product development management services', ' and Computer-aided Design Software']"
75,Q1 Solutions LLC,Information Technology and Services,Sayreville,NJ,15,Privately Held,"We provide structured cabling, TV mounting, Call center services(inbound, outbound), Data Network design/implementation solutions and IT training services  that enable our clients to strengthen their web presence, brand awareness , increase customer reliability and data center applications. Our experts understand your business requirements and deliver high quality business solutions.
?
Call center Services:
We customize every call center program (inbound/outbound) to meet our clients’ needs. No program is considered too large or too small. Our experienced extremely flexible network of integrated call centers gives us the unique abilities to precisely match agents to volume.
 
Generating Leads:
We usually find quality leads in a specified Niche by using different mediums. We worked in both ways either you provide us a list of companies & we append the Owner Name & Emails for you or you provide us a criteria to find the quality leads & contact information. Mostly used tools which help to find authentic email addresses are LinkedIn, Repportive, Email Extractor Software (In-house build), Email Hunter, Zoom info, Business Websites & Specialized Web Research.
?
IT Traingings:
Q1 is renowned nationwide for the high quality of its education and training courses. Many of our clients took their first computer training course with us at introductory and beginner level and have progressed with us to advanced and expert levels.
 
Data Network Solutions:
At Q1 Solutions Provider division, we always focus on helping and supporting your business stay up todate with the cost effective IT solutions. We are specialists in designing, planning, implementing and managing/handling technology and security solutions for businesses of all sizes (small/medium/large). Our team of Data Network engineers and consultants can plan and implement a solution that will delivers the most cost effective results and achievement for your business. 

                                                                                                              Our mission:
We provide solution-based services to those small business owners who want to keep connected with their customers.We suggest innovative strategies and plans to acquire benefits of social web media and how to profitably take the visitors to your website. Our mission is to give your clients an elegant online experience.

Our full-service team of in-house technicians is available to provide technical assistance 24/7/365.We keep you stay ahead of market with commitment, dedication and innovation.",https://www.q1solutionsllc.com/,"['structured cabling', ' TV mounting', ' Inbound call center services', ' outbound call center services', ' Data Network design and implementation solutions', '  IT training services', ' and Data center network design configurations']"
76,Parity Technologies,Information Technology and Services,London,London,34,Privately Held,"Parity’s mission is to enable businesses and organisations to capitalise on blockchain technology and benefit from the new opportunities it presents. We develop cutting-edge software solutions for enterprises and industries to unlock the full value of decentralised technology. We believe that decentralised technology has the power to fundamentally change and enhance the systems used by businesses, consumers, and governments every day.",https://www.paritytech.io,"['Ethereum', ' Blockchain', ' Computer Science', ' Products', ' and Solutions']"
77,Innopolis University,Information Technology and Services,Innopolis,Tatarstan,159,Educational Institution,"Innopolis University is meant to be a brain force, an integral element of a new Innopolis city – the future IT capital of Russia.

Mission of Innopolis project is to create favorable opportunities for the economic growth of the Russian Federation through further development of Information Technology, improving welfare of the nation and creation of a highly professional and intellectual society.

Innopolis key features:

* A federal level project
* High technologies as the key specialization
* Prospective population of 150 thousand people, 60 thousand of them are to be represented by highly-skilled * professionals
* Territory of more than 1,200 Ha
* A special economic zone of technology development type and technology parks offering preferences for investors and residents
* The first Russian university focusing on advanced Computer Science
* Comfortable and affordable housing, modern educational, medical, sports and entertainment infrastructure – implementation of the “Live, learn, work and play” concept
* Picturesque, ecologically clean area",http://university.innopolis.ru,"['Higher Education', ' Software Engineering', ' Information Technologies', ' Computer Science', ' and Robotics']"
78,Tangible Benefit,Information Technology and Services,London,London,89,Privately Held,"Tangible Benefit is a leading corporate supplier of IT hardware, software and services. 

Established in 1997, we were reborn in 2009 after a management buyout. We deliver product and solutions from our central London office & warehouse all over the UK and into Europe.

Our core competencies are the supply and integration of IT infrastructure technology, ranging from complex data centre solutions to Workgroup Servers and volume deployments of Laptop and Desktop systems. We also provide a full range of complementary engineering and consultancy services in Implementation, Consolidation and Virtualisation.

Our extensive list of partners include:

- HP Gold Preferred Partner 
- Lenovo Premium Gold Business Partner
- Microsoft Authorised Device Reseller
- Dell Preferred Partner 
- Toshiba Principal Partner
- Hitachi Data Systems Partner
- NetApp Partner
- Cisco Select Certified Partner 
- EMC Velocity Partner 
- VMware VIP Professional Partner 

We continue to maintain our positive trajectory with year on year average growth of 25% – and have been recognised by Real Business Magazine in conjunction with Dun and Bradstreet, who previously named Tangible Benefit the 2nd fastest growing privately owned UK company. 

Subsequent to our continued excellent performance and our ambitious plans for the future, we are currently recruiting for sales staff at all levels – offering industry leading graduate schemes for those new to the industry, and ongoing development programmes for experienced sales professionals. 

Please call us on 020 7837 7737. Nick Barratt is our Sales Director and Maria Bywater is our Recruitment Manager",http://www.tangiblebenefit.com,"['Computer Infrastructure', ' Client-Side hardware', ' Server-Side Hardware', ' and Related IT services']"
79,PC Medic - Your Best Choice for PC & MAC Solutions,Information Technology and Services,Halifax,NS,35,Privately Held,"PC Medic, your Computer Solutions Company.  

PC Medic is an Atlantic Canada based company that offers complete hardware, software, and Internet connectivity, network solutions as well hardware product support. 

PC Medic was founded in January 1999. Our customized solutions include full service warranties and support.

We strive to supply our clients with all aspects of a complete and customized computer solution. 

Our head office is located in Halifax, Nova Scotia with sister stores in Moncton and St. John's, NL.",http://www.pcmedic.com,"['sales', ' service', ' pos', ' server', ' networking', ' networks', ' security', ' web hosting', ' computer', ' notebook', ' apple', ' mac', ' and printer']"
